{
  "schemaVersion": "1",
  "tool": "seo-rea",
  "toolVersion": "0.4.0",
  "kind": "crawl",
  "runId": "20261016T013421Z",
  "domain": "cardpointers.com",
  "startUrl": "https://cardpointers.com/",
  "timestamps": {
    "started": "2026-10-16T01:34:21.090Z",
    "finished": "2026-10-16T01:35:45.735Z"
  },
  "limits": {
    "maxPages": 300,
    "maxDepth": 10,
    "delayMs": 500
  },
  "stats": {
    "pagesCrawled": 70,
    "htmlPages": 65,
    "indexable": 59,
    "queuedLeft": 0,
    "blockedByRobots": 0,
    "sitemapUrls": 15,
    "resumed": false,
    "complete": true
  },
  "robots": {
    "fetched": false,
    "sitemaps": []
  },
  "pages": [
    {
      "url": "https://cardpointers.com/",
      "finalUrl": "https://cardpointers.com/",
      "status": 200,
      "depth": 0,
      "source": "start",
      "contentType": "text/html",
      "title": "CardPointers: Credit card rewards made easy",
      "metaDescription": "Earn more rewards from your credit cards every day.",
      "metaRobots": "",
      "canonical": "",
      "h1": [
        "Earn more from your credit cards every day."
      ],
      "h2Count": 4,
      "wordCount": 483,
      "lang": "en",
      "hreflang": [],
      "schemaTypes": [],
      "internalLinks": [
        "https://cardpointers.com/partner/prime/",
        "https://cardpointers.com/",
        "https://cardpointers.com/search/",
        "https://cardpointers.com/apps/iphone/",
        "https://cardpointers.com/apps/ipad/",
        "https://cardpointers.com/apps/mac/",
        "https://cardpointers.com/apps/vision/",
        "https://cardpointers.com/apps/watch/",
        "https://cardpointers.com/apps/carplay/",
        "https://cardpointers.com/apps/android/",
        "https://cardpointers.com/app/",
        "https://cardpointers.com/ai/",
        "https://cardpointers.com/extension/",
        "https://cardpointers.com/cards/",
        "https://cardpointers.com/offers/",
        "https://cardpointers.com/pro/",
        "https://help.cardpointers.com/",
        "https://cardpointers.com/account/",
        "https://cardpointers.com/login/",
        "https://cardpointers.com/signup/",
        "https://cardpointers.com/gift/",
        "https://cardpointers.com/privacy/"
      ],
      "externalLinkCount": 10,
      "externalDomains": [
        "apps.apple.com",
        "play.google.com",
        "chrome.google.com",
        "addons.mozilla.org",
        "impresskit.net",
        "instagram.com",
        "twitter.com",
        "reddit.com",
        "youtube.com",
        "facebook.com"
      ],
      "published": "",
      "modified": "",
      "tech": [
        "Nuxt"
      ],
      "contentHash": "8e3c519f55bb715dcff780a2c3fe797d89295bdb",
      "fetchedAt": "2026-10-16T01:34:21.581Z"
    },
    {
      "url": "https://cardpointers.com/apps/iphone/",
      "finalUrl": "https://cardpointers.com/apps/iphone/",
      "status": 200,
      "depth": 1,
      "source": "sitemap",
      "contentType": "text/html",
      "title": "CardPointers for iPhone",
      "metaDescription": "iPhone app to help you maximize your credit cards rewards.",
      "metaRobots": "",
      "canonical": "",
      "h1": [],
      "h2Count": 9,
      "wordCount": 884,
      "lang": "en",
      "hreflang": [],
      "schemaTypes": [],
      "internalLinks": [
        "https://cardpointers.com/partner/prime/",
        "https://cardpointers.com/",
        "https://cardpointers.com/search/",
        "https://cardpointers.com/apps/iphone/",
        "https://cardpointers.com/apps/ipad/",
        "https://cardpointers.com/apps/mac/",
        "https://cardpointers.com/apps/vision/",
        "https://cardpointers.com/apps/watch/",
        "https://cardpointers.com/apps/carplay/",
        "https://cardpointers.com/apps/android/",
        "https://cardpointers.com/app/",
        "https://cardpointers.com/ai/",
        "https://cardpointers.com/extension/",
        "https://cardpointers.com/cards/",
        "https://cardpointers.com/offers/",
        "https://cardpointers.com/pro/",
        "https://help.cardpointers.com/",
        "https://cardpointers.com/account/",
        "https://cardpointers.com/login/",
        "https://cardpointers.com/signup/",
        "https://cardpointers.com/gift/",
        "https://cardpointers.com/privacy/"
      ],
      "externalLinkCount": 8,
      "externalDomains": [
        "apps.apple.com",
        "impresskit.net",
        "instagram.com",
        "twitter.com",
        "reddit.com",
        "youtube.com",
        "facebook.com"
      ],
      "published": "",
      "modified": "",
      "tech": [
        "Nuxt"
      ],
      "contentHash": "c7b8eacee7228aa0d4ffe1b0ab6ac85deee4be04",
      "fetchedAt": "2026-10-16T01:34:22.155Z"
    },
    {
      "url": "https://cardpointers.com/apps/ipad/",
      "finalUrl": "https://cardpointers.com/apps/ipad/",
      "status": 200,
      "depth": 1,
      "source": "sitemap",
      "contentType": "text/html",
      "title": "CardPointers for iPad",
      "metaDescription": "iPad app to help you maximize your credit cards rewards.",
      "metaRobots": "",
      "canonical": "",
      "h1": [],
      "h2Count": 2,
      "wordCount": 228,
      "lang": "en",
      "hreflang": [],
      "schemaTypes": [],
      "internalLinks": [
        "https://cardpointers.com/partner/prime/",
        "https://cardpointers.com/",
        "https://cardpointers.com/search/",
        "https://cardpointers.com/apps/iphone/",
        "https://cardpointers.com/apps/ipad/",
        "https://cardpointers.com/apps/mac/",
        "https://cardpointers.com/apps/vision/",
        "https://cardpointers.com/apps/watch/",
        "https://cardpointers.com/apps/carplay/",
        "https://cardpointers.com/apps/android/",
        "https://cardpointers.com/app/",
        "https://cardpointers.com/ai/",
        "https://cardpointers.com/extension/",
        "https://cardpointers.com/cards/",
        "https://cardpointers.com/offers/",
        "https://cardpointers.com/pro/",
        "https://help.cardpointers.com/",
        "https://cardpointers.com/account/",
        "https://cardpointers.com/login/",
        "https://cardpointers.com/signup/",
        "https://cardpointers.com/gift/",
        "https://cardpointers.com/privacy/"
      ],
      "externalLinkCount": 7,
      "externalDomains": [
        "apps.apple.com",
        "impresskit.net",
        "instagram.com",
        "twitter.com",
        "reddit.com",
        "youtube.com",
        "facebook.com"
      ],
      "published": "",
      "modified": "",
      "tech": [
        "Nuxt"
      ],
      "contentHash": "9ce562c7da7fcc96ea602e4c252a63223349077c",
      "fetchedAt": "2026-10-16T01:34:22.787Z"
    },
    {
      "url": "https://cardpointers.com/apps/watch/",
      "finalUrl": "https://cardpointers.com/apps/watch/",
      "status": 200,
      "depth": 1,
      "source": "sitemap",
      "contentType": "text/html",
      "title": "CardPointers for Apple Watch",
      "metaDescription": "Apple Watch app to help you maximize your credit cards rewards.",
      "metaRobots": "",
      "canonical": "",
      "h1": [],
      "h2Count": 6,
      "wordCount": 414,
      "lang": "en",
      "hreflang": [],
      "schemaTypes": [],
      "internalLinks": [
        "https://cardpointers.com/partner/prime/",
        "https://cardpointers.com/",
        "https://cardpointers.com/search/",
        "https://cardpointers.com/apps/iphone/",
        "https://cardpointers.com/apps/ipad/",
        "https://cardpointers.com/apps/mac/",
        "https://cardpointers.com/apps/vision/",
        "https://cardpointers.com/apps/watch/",
        "https://cardpointers.com/apps/carplay/",
        "https://cardpointers.com/apps/android/",
        "https://cardpointers.com/app/",
        "https://cardpointers.com/ai/",
        "https://cardpointers.com/extension/",
        "https://cardpointers.com/cards/",
        "https://cardpointers.com/offers/",
        "https://cardpointers.com/pro/",
        "https://help.cardpointers.com/",
        "https://cardpointers.com/account/",
        "https://cardpointers.com/login/",
        "https://cardpointers.com/signup/",
        "https://cardpointers.com/gift/",
        "https://cardpointers.com/privacy/"
      ],
      "externalLinkCount": 7,
      "externalDomains": [
        "apps.apple.com",
        "impresskit.net",
        "instagram.com",
        "twitter.com",
        "reddit.com",
        "youtube.com",
        "facebook.com"
      ],
      "published": "",
      "modified": "",
      "tech": [
        "Nuxt"
      ],
      "contentHash": "a47d691c477bdec737bd2a1da461b770b5fa9f18",
      "fetchedAt": "2026-10-16T01:34:23.414Z"
    },
    {
      "url": "https://cardpointers.com/apps/vision/",
      "finalUrl": "https://cardpointers.com/apps/vision/",
      "status": 200,
      "depth": 1,
      "source": "sitemap",
      "contentType": "text/html",
      "title": "CardPointers for Apple Vision Pro",
      "metaDescription": "Apple Vision Pro app to help you maximize your credit cards rewards.",
      "metaRobots": "",
      "canonical": "",
      "h1": [],
      "h2Count": 4,
      "wordCount": 465,
      "lang": "en",
      "hreflang": [],
      "schemaTypes": [],
      "internalLinks": [
        "https://cardpointers.com/partner/prime/",
        "https://cardpointers.com/",
        "https://cardpointers.com/search/",
        "https://cardpointers.com/apps/iphone/",
        "https://cardpointers.com/apps/ipad/",
        "https://cardpointers.com/apps/mac/",
        "https://cardpointers.com/apps/vision/",
        "https://cardpointers.com/apps/watch/",
        "https://cardpointers.com/apps/carplay/",
        "https://cardpointers.com/apps/android/",
        "https://cardpointers.com/app/",
        "https://cardpointers.com/ai/",
        "https://cardpointers.com/extension/",
        "https://cardpointers.com/cards/",
        "https://cardpointers.com/offers/",